{
  "name": "configured-non-trivial-planning",
  "protocolVersion": "1.1",
  "input": {
    "protocolVersion": "1.1",
    "requestId": "configured-non-trivial-planning",
    "repository": {
      "configured": true,
      "configVersion": 1,
      "protocolCompatibility": "compatible",
      "instructionFiles": ["AGENTS.md"],
      "setupEvidence": true,
      "planningEvidence": false,
      "planningGate": "non-trivial"
    },
    "request": {
      "classification": {
        "value": "non-trivial",
        "source": "model",
        "reasons": ["The request is a refactor with multiple verifiable deliverables."]
      },
      "explicitOnboarding": false,
      "explicitLighterProcess": false,
      "mutationRequested": true,
      "implementationFinished": false
    },
    "availableSkills": [
      { "name": "iterations-planner", "source": "global", "selected": true, "relevant": true }
    ],
    "hostCapabilities": [
      "repository:read",
      "instructions:read",
      "skills:read",
      "workspace:plan-write",
      "workspace:mutate",
      "commands:execute"
    ],
    "evidence": []
  },
  "expected": {
    "protocolVersion": "1.1",
    "requestId": "configured-non-trivial-planning",
    "phase": "planning",
    "effectiveClassification": "non-trivial",
    "requiredGates": [
      { "id": "setup", "status": "satisfied", "reasonCode": "CONFIGURATION_PRESENT" },
      { "id": "planning", "status": "required", "reasonCode": "PLANNING_REQUIRED" },
      { "id": "verification", "status": "pending", "reasonCode": "VALIDATION_REQUIRED" }
    ],
    "selectedSkills": [
      { "name": "iterations-planner", "required": true, "reasonCode": "PLANNING_REQUIRED" }
    ],
    "requestedCapabilities": [
      "repository:read",
      "instructions:read",
      "skills:read",
      "workspace:plan-write"
    ],
    "completionCriteria": [
      { "id": "gates-satisfied", "status": "pending", "hard": true },
      { "id": "implementation-accounted-for", "status": "pending", "hard": true },
      { "id": "validation-evidence", "status": "pending", "hard": true },
      { "id": "documentation-aligned", "status": "pending", "hard": false },
      { "id": "assumptions-reported", "status": "pending", "hard": false },
      { "id": "learning-reviewed", "status": "pending", "hard": false }
    ],
    "canComplete": false,
    "reasons": ["CONFIGURATION_PRESENT", "TASK_NON_TRIVIAL", "PLANNING_REQUIRED"],
    "diagnostics": []
  }
}
